{
  "version": 1,
  "apps": {
    "code": { "names": ["Code", "Visual Studio Code"] },
    "claude": { "names": ["Claude"] },
    "chatgpt": { "names": ["ChatGPT"] },
    "hermes": { "names": ["Hermes"] },
    "input_source_pro": { "names": ["Input Source Pro"] },
    "obsidian": { "names": ["Obsidian"] },
    "zotero": { "names": ["Zotero"] },
    "thunderbird": { "names": ["Thunderbird", "thunderbird"] },
    "word": { "names": ["Microsoft Word"] },
    "powerpoint": { "names": ["Microsoft PowerPoint"] },
    "outlook": { "names": ["Microsoft Outlook"] },
    "zoom": { "names": ["zoom.us", "Zoom"] },
    "teams": { "names": ["Microsoft Teams", "MSTeams"] },
    "dia": { "names": ["Dia"] },
    "finder": { "names": ["Finder"] },
    "preview": { "names": ["Preview", "预览"] },
    "notes": { "names": ["Notes"] },
    "calendar": { "names": ["Calendar"] },
    "reminders": { "names": ["Reminders"] },
    "wechat": { "names": ["WeChat"] },
    "keybase": { "names": ["Keybase"] },
    "messages": { "names": ["Messages"] },
    "dingtalk": { "names": ["DingTalk", "钉钉"] },
    "whatsapp": { "names": ["WhatsApp"] },
    "facetime": { "names": ["FaceTime"] },
    "warp": { "names": ["Warp"] },
    "smartgit": { "names": ["SmartGit"] },
    "keepassx": { "names": ["KeePassXC", "KeePassX"] },
    "flclash": { "names": ["FlClash"] },
    "thaw": { "names": ["Thaw"] },
    "portfolio_performance": { "names": ["Portfolio Performance"] }
  },
  "layouts": {
    "single_full": [
      { "role": "primary", "grid": "1:1:0:0:1:1" }
    ],
    "coding_editor_wide": [
      { "role": "primary", "grid": "1:3:1:0:2:1" },
      { "role": "helper", "grid": "1:3:0:0:1:1" }
    ],
    "coding_editor_tall": [
      { "role": "primary", "grid": "2:1:0:1:1:1" },
      { "role": "helper", "grid": "2:1:0:0:1:1" }
    ],
    "research_horizontal": [
      { "role": "primary", "grid": "1:3:0:0:2:1" },
      { "role": "helper", "grid": "1:3:2:0:1:1" }
    ],
    "research_tall": [
      { "role": "primary", "grid": "2:1:0:0:1:1" },
      { "role": "helper", "grid": "2:1:0:1:1:1" }
    ],
    "office_wide_profile": [
      { "role": "helper", "grid": "1:3:0:0:1:1" },
      { "role": "primary", "grid": "1:3:1:0:2:1" }
    ],
    "office_tall_profile": [
      { "role": "helper", "grid": "2:1:0:0:1:1" },
      { "role": "primary", "grid": "2:1:0:1:1:1" }
    ],
    "gtd_support_solo_profile": [
      { "role": "dia", "grid": "1:1:0:0:1:1" }
    ],
    "gtd_support_wide_profile": [
      { "role": "dia", "grid": "1:2:0:0:1:1" }
    ],
    "gtd_support_tall_profile": [
      { "role": "dia", "grid": "2:1:0:1:1:1" }
    ],
    "gtd_review_solo": [
      { "role": "finder", "grid": "2:3:0:0:1:1" },
      { "role": "preview", "grid": "2:3:1:0:2:1" },
      { "role": "chatgpt", "grid": "2:2:0:1:1:1" },
      { "role": "notes", "grid": "2:2:1:1:1:1" }
    ],
    "gtd_review_wide": [
      { "role": "finder", "grid": "2:16:0:0:4:2" },
      { "role": "preview", "grid": "2:16:4:0:6:2" },
      { "role": "obsidian", "grid": "2:16:10:0:6:1" },
      { "role": "chatgpt", "grid": "2:16:10:1:3:1" },
      { "role": "notes", "grid": "2:16:13:1:3:1" }
    ],
    "gtd_review_tall": [
      { "role": "preview", "grid": "4:2:0:0:2:2" },
      { "role": "finder", "grid": "4:2:0:2:1:1" },
      { "role": "obsidian", "grid": "4:2:1:2:1:1" },
      { "role": "chatgpt", "grid": "4:2:0:3:1:1" },
      { "role": "notes", "grid": "4:2:1:3:1:1" }
    ],
    "gtd_mail_solo": [
      { "role": "helper", "grid": "2:1:0:0:1:1" },
      { "role": "primary", "grid": "2:1:0:1:1:1" }
    ],
    "gtd_mail_wide": [
      { "role": "helper", "grid": "1:2:0:0:1:1" },
      { "role": "primary", "grid": "1:2:1:0:1:1" }
    ],
    "gtd_meeting_solo": [
      { "role": "zoom", "grid": "2:1:0:0:1:1" },
      { "role": "teams", "grid": "2:1:0:1:1:1" }
    ],
    "gtd_meeting_wide": [
      { "role": "zoom", "grid": "1:2:0:0:1:1" },
      { "role": "teams", "grid": "1:2:1:0:1:1" }
    ],
    "gtd_ai_solo": [
      { "role": "hermes", "grid": "2:3:0:0:3:1" },
      { "role": "chatgpt", "grid": "2:3:0:1:1:1" },
      { "role": "obsidian", "grid": "2:3:1:1:1:1" },
      { "role": "notes", "grid": "2:3:2:1:1:1" }
    ],
    "gtd_ai_wide": [
      { "role": "notes", "grid": "2:4:0:0:1:1" },
      { "role": "obsidian", "grid": "2:4:0:1:1:1" },
      { "role": "hermes", "grid": "1:4:1:0:2:1" },
      { "role": "chatgpt", "grid": "1:4:3:0:1:1" }
    ],
    "gtd_ai_tall": [
      { "role": "hermes", "grid": "2:3:0:0:2:1" },
      { "role": "chatgpt", "grid": "2:3:0:1:2:1" },
      { "role": "obsidian", "grid": "2:3:2:0:1:1" },
      { "role": "notes", "grid": "2:3:2:1:1:1" }
    ],
    "coding_control": [
      { "role": "warp", "grid": "3:1:0:0:1:2" },
      { "role": "smartgit", "move_abs": "abs:300:60", "resize_abs": "abs:1200:1040" },
      { "role": "flclash", "move_abs": "abs:360:120", "resize_abs": "abs:1200:1040" },
      { "role": "thaw", "move_abs": "abs:360:120", "resize_abs": "abs:1200:1040" },
      { "role": "portfolio_performance", "move_abs": "abs:420:180", "resize_abs": "abs:1220:852" }
    ],
    "gtd_chat": [
      { "role": "keybase", "grid": "2:2:0:0:1:1" },
      { "role": "wechat", "grid": "2:2:0:1:1:1" },
      { "role": "dingtalk", "grid": "2:2:1:0:1:1" },
      { "role": "messages", "grid": "2:2:1:1:1:1" },
      { "role": "whatsapp", "move_abs": "abs:458:190", "resize_abs": "abs:885:560" },
      { "role": "facetime", "move_abs": "abs:458:190", "resize_abs": "abs:885:560" }
    ],
    "gtd_calendar": [
      { "role": "calendar", "grid": "1:2:0:0:1:1" },
      { "role": "reminders", "grid": "1:2:1:0:1:1" }
    ]
  },
  "workspaces": {
    "coding_editor_solo": {
      "runner": "primary_helper", "label": "coding_editor_solo", "display_role": "primary", "space_layout": "float",
      "windows": [{ "role": "primary", "app_key": "code", "required": true, "selector": { "movable": true } }],
      "layout_ref": "single_full", "cleanup": { "family": "coding", "opposite_modes": ["wide", "tall"] }
    },
    "coding_editor_wide": {
      "runner": "primary_helper", "label": "coding_editor_wide", "display_role": "wide", "space_layout": "float",
      "windows": [
        { "role": "primary", "app_key": "code", "required": true, "selector": { "movable": true } },
        { "role": "helper", "app_key": "chatgpt", "required": false, "selector": { "movable": true } }
      ],
      "layout_ref": "coding_editor_wide", "primary_alone_layout_ref": "single_full",
      "cleanup": { "family": "coding", "opposite_modes": ["tall", "solo"] }
    },
    "coding_editor_tall": {
      "runner": "primary_helper", "label": "coding_editor_tall", "display_role": "tall", "space_layout": "float",
      "windows": [
        { "role": "primary", "app_key": "code", "required": true, "selector": { "movable": true } },
        { "role": "helper", "app_key": "chatgpt", "required": false, "selector": { "movable": true } }
      ],
      "layout_ref": "coding_editor_tall", "primary_alone_layout_ref": "single_full",
      "cleanup": { "family": "coding", "opposite_modes": ["wide", "solo"] }
    },
    "coding_control": {
      "runner": "fixed_adapter", "runner_options": { "adapter": "coding_control" },
      "label": "coding_control", "display_role": "primary", "space_layout": "float",
      "windows": [
        { "role": "warp", "app_key": "warp", "required": false },
        { "role": "smartgit", "app_key": "smartgit", "required": false },
        { "role": "keepassx", "app_key": "keepassx", "required": false },
        { "role": "flclash", "app_key": "flclash", "required": false },
        { "role": "thaw", "app_key": "thaw", "required": false },
        { "role": "portfolio_performance", "app_key": "portfolio_performance", "required": false }
      ],
      "layout_ref": "coding_control"
    },
    "research_solo": {
      "runner": "primary_helper", "label": "research_solo", "display_role": "primary", "space_layout": "float",
      "windows": [
        { "role": "primary", "app_key": "zotero", "required": true, "selector": { "movable": true } },
        { "role": "helper", "app_key": "claude", "required": false, "selector": { "movable": true, "visible": true } }
      ],
      "layout_ref": "research_horizontal", "cleanup": { "family": "research", "opposite_modes": ["wide", "tall"] }
    },
    "research_wide": {
      "runner": "primary_helper", "label": "research_wide", "display_role": "wide", "space_layout": "float",
      "windows": [
        { "role": "primary", "app_key": "zotero", "required": true, "selector": { "movable": true } },
        { "role": "helper", "app_key": "claude", "required": false, "selector": { "movable": true } }
      ],
      "layout_ref": "research_horizontal", "cleanup": { "family": "research", "opposite_modes": ["tall", "solo"] }
    },
    "research_tall": {
      "runner": "primary_helper", "label": "research_tall", "display_role": "tall", "space_layout": "float",
      "windows": [
        { "role": "primary", "app_key": "zotero", "required": true, "selector": { "movable": true } },
        { "role": "helper", "app_key": "claude", "required": false, "selector": { "movable": true } }
      ],
      "layout_ref": "research_tall", "cleanup": { "family": "research", "opposite_modes": ["wide", "solo"] }
    },
    "office_writing_wide": {
      "runner": "office_document", "runner_options": { "mode": "wide" },
      "label": "office_writing_wide", "display_role": "wide", "space_layout": "float",
      "windows": [
        { "role": "primary", "app_key": "word", "required": false, "selector": { "movable": true } },
        { "role": "helper", "app_key": "chatgpt", "required": false, "selector": { "movable": true } }
      ],
      "layout_ref": "office_wide_profile", "cleanup": { "family": "office", "opposite_modes": ["tall"] }
    },
    "office_slides_wide": {
      "runner": "office_document", "runner_options": { "mode": "wide" },